{
  "schema_version": "1.0.0",
  "workflow": "default",
  "created_at": "2026-01-12T20:00:00Z",
  "updated_at": "2026-01-12T21:30:00Z",
  "rounds": [
    {
      "round": 1,
      "timestamp": "2026-01-12T20:00:00Z",
      "documents": {
        "readme": {
          "path": "README.md",
          "char_count": 5420,
          "word_count": 892,
          "line_count": 145,
          "heading_count": 12,
          "code_block_count": 5,
          "link_count": 8,
          "list_item_count": 23
        },
        "spec": {
          "path": "SPEC.md",
          "char_count": 14820,
          "word_count": 2331,
          "line_count": 412
        },
        "implementation": null
      },
      "output": {
        "path": ".apr/rounds/default/round_1.md",
        "char_count": 8500,
        "word_count": 1400,
        "line_count": 180
      },
      "changes_from_previous": null
    }
  ],
  "convergence": {
    "detected": false,
    "confidence": 0.0,
    "estimated_rounds_remaining": null,
    "signals": {
      "output_size_trend": "unknown",
      "change_velocity": "unknown",
      "similarity_trend": "unknown"
    }
  }
}
